{"$schema":"https://json-schema.org/draft/2020-12/schema","$id":"urn:project-scan:forex-event-batch:1.0","type":"object","required":["batch_schema_version","document_type","event_schema_versions","count","truncated","events"],"properties":{"batch_schema_version":{"const":"1.0"},"document_type":{"const":"forex_event_batch"},"event_schema_versions":{"type":"array","items":{"type":"string"},"uniqueItems":true},"count":{"type":"integer","minimum":0},"truncated":{"type":"boolean"},"events":{"type":"array"}}}
