{"batch_schema_version":"1.0","document_type":"forex_event_batch","event_schema_versions":["1.0"],"count":1,"truncated":false,"events":[{"event_schema_version":"1.0","event_id":"event_example","event_type":"scan.completed","occurred_at":"2026-08-20T00:00:00.000Z","producer":{"name":"SCAN","version":"2.0.0"},"scan_id":"scan_example","target_id":"target_example","subject":{},"observation":{},"evidence_refs":[],"confidence":"observed","limitations":[],"deduplication_key":"dedup_example"}]}
